{
  "format": "jana.ops.probe.1",
  "test_name": "ops18_load_test_at_twice_peak",
  "candidate_commit": "FILL-IN: the 40-character commit id of the candidate tested",
  "spec_revision": "FILL-IN: the specification revision in spec.lock",
  "source": "staging_probe",
  "started_at": "FILL-IN: date-time with zone when the test or drill started",
  "completed_at": "FILL-IN: date-time with zone when it finished",
  "data": {
    "active_students": "FILL-IN: a whole number: Forecast active cloud students",
    "tested_concurrency": "FILL-IN: a number: Concurrent turns the load test reached",
    "contracted_concurrency": "FILL-IN: a number: Concurrent turns the provider contracts allow",
    "objectives_passed": "FILL-IN: true or false: Did every gateway objective hold?",
    "school_quotas_enforced": "FILL-IN: true or false: Were per-school quotas enforced?",
    "device": "FILL-IN: Device or environment used: hardware class, model and asset label, OS version (or the staging environment name)"
  }
}
