{
  "format": "jana.ops.probe.1",
  "test_name": "ops34_drills_current",
  "candidate_commit": "FILL-IN: the 40-character commit id of the candidate tested",
  "spec_revision": "FILL-IN: the specification revision in spec.lock",
  "source": "staff_drill",
  "started_at": "FILL-IN: date-time with zone when the test or drill started",
  "completed_at": "FILL-IN: date-time with zone when it finished",
  "data": {
    "term_start": "FILL-IN: date-time with zone: Start of the current school term (date-time with zone, e.g. 2026-09-07T00:00:00+01:00)",
    "release_at": "FILL-IN: date-time with zone: Time this release candidate was cut (date-time with zone)",
    "drills": [
      {
        "name": "FILL-IN: one of checkout, child_safety, cloud_failover, cloud_switch, content_correction, cost_spike, data_breach, halt, lan_restore, model_withdrawal, origin_usb, release, safety_configuration, school_update, signing_compromise, skill_pin, web_rollback: Runbook drilled",
        "owner": "FILL-IN: text: Runbook owner (name or role)",
        "at": "FILL-IN: date-time with zone: Time of the drill",
        "passed": "FILL-IN: true or false: Did the drill pass?",
        "evidence_sha256": "FILL-IN: the SHA-256 of this raw proof file, which is also listed in the index: the drill record (log, notes or recording)",
        "trigger": "FILL-IN: text: What triggered it (short)",
        "steps": "FILL-IN: a list of strings: Steps followed (comma list of short step names)",
        "verification": "FILL-IN: text: How success was verified (short)",
        "rollback": "FILL-IN: text: How it was rolled back (short)",
        "offline_copy": "FILL-IN: text: Where the offline copy of the runbook is kept",
        "actions": [
          {
            "description": "FILL-IN: text: Action",
            "owner": "FILL-IN: text: Owner",
            "due": "FILL-IN: date-time with zone: Due (date-time with zone)"
          }
        ]
      }
    ],
    "device": "FILL-IN: Device or environment used: hardware class, model and asset label, OS version (or the staging environment name)"
  }
}
