{
  "format": "jana.ops.probe.1",
  "test_name": "ops31_child_safety_tabletop",
  "candidate_commit": "FILL-IN: the 40-character commit id of the candidate tested",
  "spec_revision": "FILL-IN: the specification revision in spec.lock",
  "source": "staff_drill",
  "started_at": "FILL-IN: date-time with zone when the test or drill started",
  "completed_at": "FILL-IN: date-time with zone when it finished",
  "data": {
    "incident": {
      "incident_id": "FILL-IN: text: Exercise incident id (e.g. tabletop-2026-11-03)",
      "severity": "FILL-IN: one of SEV1, SEV2, SEV3: Severity the team declared",
      "commander": "FILL-IN: text: Incident commander (name or role)",
      "communications_lead": "FILL-IN: text: Communications lead (name or role)",
      "declared_at": "FILL-IN: date-time with zone: Time the scenario report was declared an incident",
      "category": "child_safety",
      "state": "contained",
      "acknowledged_at": "FILL-IN: date-time with zone: Time the commander acknowledged",
      "contained_at": "FILL-IN: date-time with zone: Time containment was in place",
      "timeline": [
        [
          "FILL-IN: date-time with zone: Time the commander acknowledged",
          "FILL-IN: text: Incident commander (name or role)",
          "acknowledged"
        ],
        [
          "FILL-IN: date-time with zone: Time containment was in place",
          "FILL-IN: text: Incident commander (name or role)",
          "contained"
        ]
      ]
    },
    "tabletop": {
      "incident_id": "FILL-IN: text: Exercise incident id (e.g. tabletop-2026-11-03)",
      "safety_lead": "FILL-IN: text: Safety lead (name or role)",
      "handed_off_at": "FILL-IN: date-time with zone: Time it was handed to the Safety lead",
      "no_student_contact": "FILL-IN: true or false: Was no student contacted directly?",
      "category_only": "FILL-IN: true or false: Were the records category-only?",
      "session_confirmation_checked": "FILL-IN: true or false: Was the bundle's per-session confirmation checked?",
      "deletion_verified": "FILL-IN: true or false: Was deletion of the held evidence verified?",
      "evidence_sha256": "FILL-IN: the SHA-256 of this raw proof file, which is also listed in the index: the exercise notes or recording",
      "hold_group": "FILL-IN: a list of strings: Safety lead's hold group, including the Safety lead (comma list)"
    },
    "device": "FILL-IN: Device or environment used: hardware class, model and asset label, OS version (or the staging environment name)"
  }
}
