{
  "format": "jana.ops.probe.1",
  "test_name": "uxs46_sections_complete",
  "candidate_commit": "FILL-IN: the 40-character commit id of the candidate tested",
  "spec_revision": "FILL-IN: the specification revision in spec.lock",
  "source": "ui_runner",
  "started_at": "FILL-IN: date-time with zone when the test or drill started",
  "completed_at": "FILL-IN: date-time with zone when it finished",
  "data": {
    "sections": "FILL-IN: [\"online_features\", \"profiles\", \"tutor_models\", \"content\", \"egress\", \"accessibility_language\", \"study\", \"tutor\", \"data_export\", \"licence\", \"help\", \"about\"] if yes, [\"not_as_expected\"] if no: Does Settings list exactly the sections the checklist's step 2 names, in that order, and no other?",
    "pin_prompts": "FILL-IN: a whole number: How many PIN prompts appeared?",
    "removed_keys": "FILL-IN: a list of strings: Removed settings that appeared anywhere (comma list)",
    "os_network_blocked": "FILL-IN: true or false: Was networking disabled at the OS level?",
    "nonloopback_attempts": "FILL-IN: a whole number: Outbound (non-loopback) connection attempts the monitor recorded",
    "rendered_sections": [
      "FILL-IN: one section"
    ],
    "device": "FILL-IN: Device or environment used: hardware class, model and asset label, OS version (or the staging environment name)"
  }
}
